id,created_at,updated_at,product_code,title,description,model_size,model_height,fabric_stretch,fabric_material,main_fiber_content,care_advice,care_instructions,price,markdown
1,2019-07-26 17:10:54.111126,2019-07-26 17:10:56.672048,1455817,Peek & Beau Curve Exclusive Eco scoop swimsuit with drawstring channel waist in floral,,Model wears: UK S/ EU S/ US XS,Model's height: 178cm/5'10,"",Slightly sheer cotton,"",See below for full care instructions,"Unless you're about that multicoloured life
Dry clean only",57.0,0.0
4,2019-07-26 17:10:54.170177,2019-07-26 17:10:58.434052,1447066,Pull&Bear v neck mini dress in peach,,Model wears: UK S/ EU S/ US XS,Model's height: 173cm/5'8,Go-with-everything jersey,Go-with-everything jerseyWe partner with the Better Cotton Initiative to improve cotton farming globally This makes it better for farmers and the environment BCI provides farming-practice training It promotes things like water efficiency and reducing the most harmful chemicals,"","","",32.0,0.0
45,2019-07-26 17:10:54.366491,2019-07-26 17:11:05.400077,1467051,ASOS DESIGN denim wrap tie front midi skirt in off white,,"","",Stretchy swim fabric,Stretchy swim fabricGoes great with your vacation,"",15% Spandex.,"",45.0,0.0
29,2019-07-26 17:10:54.316777,2019-07-26 17:11:10.737846,1466811,Pull&Bear dress with crochet detail in white,,Model wears: UK 18/ EU 46/ US 14,Model's height:  180 cm/5'11,"Hey, fancy pants",Stretch lace,Main: 100% Viscose.,fancy pants Gusset: 100% Cotton  Main: 85% Polyamide,Gusset: 100% Cotton  Main: 85% Polyamide  15% Spandex.,42.0,0.0
86,2019-07-26 17:10:54.497244,2019-07-26 17:11:39.840457,1455817,Peek & Beau Curve Exclusive Eco scoop swimsuit with drawstring channel waist in floral,,Model wears: UK S/ EU S/ US XS,Model's height: 178cm/5'10,"",Slightly sheer cotton,"",Opaque lining Body: 100% Cotton  Body Lining: 100% Cotton.,Body: 100% Cotton  Body Lining: 100% Cotton.,57.0,0.0
112,2019-07-26 17:10:54.590973,2019-07-26 17:11:51.518481,1419957,The North Face Class V Hike Short 2.0 in black,,Model wears: UK S/ EU S/ US XS,Model's height: 170cm/5'7,"",Lightweight woven fabric,"",Body: 100% Polyester.,"",45.0,0.0
129,2019-07-26 17:10:54.648276,2019-07-26 17:11:59.320561,1447054,Pull&Bear Pacific crinkle swimsuit in orange,,Model wears: UK S/ EU S/ US XS,Model's height: 173cm/5'8,Soft sweatshirt fabric,Soft sweatshirt fabricWe partner with the Better Cotton Initiative to improve cotton farming globally This makes it better for farmers and the environment BCI provides farming-practice training It promotes things like water efficiency and reducing the most harmful chemicals,"",50% Polyester.,"",29.9,0.0
78,2019-07-26 17:10:54.471725,2019-09-10 22:39:54.026156,1447051,The North Face 92 Rage heavyweight long sleeve top in white,For your daytime thing,Model wears: UK S/ EU S/ US XS,Model's height: 173cm/5'8,"",Soft jersey. We partner with the Better Cotton Initiative to improve cotton farming globally. This makes it better for farmers and the environment. BCI provides farming-practice training. It promotes things like water efficiency and reducing the most harmful chemicals.,Main: 95% Polyester,"","Just here for the care instructions? Yeah, we thought so. Machine wash according to instructions on care label.",28.0,0.0
141,2019-07-26 17:10:54.687826,2019-09-10 22:39:54.372912,1447051,The North Face 92 Rage heavyweight long sleeve top in white,For your daytime thing,Model wears: UK S/ EU S/ US XS,Model's height: 173cm/5'8,"",Soft jersey. We partner with the Better Cotton Initiative to improve cotton farming globally. This makes it better for farmers and the environment. BCI provides farming-practice training. It promotes things like water efficiency and reducing the most harmful chemicals.,Main: 95% Polyester,"",Just here for the care instructions? We've got you covered. Machine wash according to instructions on care label.,28.0,0.0
218,2019-07-26 17:10:54.971581,2019-09-10 22:39:54.699312,1447051,The North Face 92 Rage heavyweight long sleeve top in white,For your daytime thing,Model wears: UK S/ EU S/ US XS,Model's height: 173cm/5'8,"",Soft jersey. We partner with the Better Cotton Initiative to improve cotton farming globally. This makes it better for farmers and the environment. BCI provides farming-practice training. It promotes things like water efficiency and reducing the most harmful chemicals.,Main: 95% Polyester,"",Avoid post-wash regrets. Always check the label.,28.0,0.0
89,2019-07-26 17:10:54.507107,2019-09-10 22:39:54.801983,1447054,The North Face Red Box hoodie in gray/pink,Throw on and go,Model wears: UK S/ EU S/ US XS,Model's height: 173cm/5'8,"",Soft sweatshirt fabric. We partner with the Better Cotton Initiative to improve cotton farming globally. This makes it better for farmers and the environment. BCI provides farming-practice training. It promotes things like water efficiency and reducing the most harmful chemicals.,Main: 95% Polyester,"","Just here for the care instructions? Yeah, we thought so. Machine wash according to instructions on care label.",29.9,0.0
238,2019-07-26 17:10:55.035428,2019-09-10 22:39:54.819357,1427302,ASOS DESIGN cami midi prom dress in palm broderie with contrast stitching,For that thing you have to go to,Model wears: UK 8/ EU 36/ US 4,Model's height:  174 cm/5'8.5,"",Broderie anglaise. Embroidered eyelet fabric. It's a cute all-rounder.,Main: 68% Cotton  32% Polyester. ,"","Just here for the care instructions? Yeah, we thought so. Machine wash according to instructions on care label.",35.0,0.0
257,2019-07-26 17:10:55.097209,2019-09-10 22:39:54.955158,1427302,ASOS DESIGN cami midi prom dress in palm broderie with contrast stitching,For that thing you have to go to,Model wears: UK 8/ EU 36/ US 4,Model's height:  174 cm/5'8.5,"",Broderie anglaise. Embroidered eyelet fabric. It's a cute all-rounder.,Main: 68% Cotton  32% Polyester. ,"","The label may be small, but it's important. Hand wash only.",35.0,0.0
194,2019-07-26 17:10:54.877404,2019-09-10 22:39:55.069068,1427302,ASOS DESIGN cami midi prom dress in palm broderie with contrast stitching,For that thing you have to go to,Model wears: UK 8/ EU 36/ US 4,Model's height:  174 cm/5'8.5,"",Broderie anglaise. Embroidered eyelet fabric. It's a cute all-rounder.,Main: 68% Cotton  32% Polyester. ,"",Clothes have needs too y'know. Machine wash according to instructions on care label.,35.0,0.0
284,2019-07-26 17:10:55.182886,2019-07-26 17:13:10.636505,1427302,Peek & Beau Curve Exclusive rib triangle bikini top in yellow,,Model wears: UK 8/ EU 36/ US 4,Model's height:  174 cm/5'8.5,Broderie anglaise,Broderie anglaiseEmbroidered eyelet fabricIt's a cute all-rounder,"",9% Cotton  Main: 68% Cotton  32% Polyester.,Main: 68% Cotton  32% Polyester.,35.0,0.0
11,2019-07-26 17:10:54.210023,2019-09-10 22:39:53.546816,1447066,The North Face Shine On t-shirt in pink with pocket,For your daytime thing,Model wears: UK S/ EU S/ US XS,Model's height: 173cm/5'8,"",Go-with-everything jersey. We partner with the Better Cotton Initiative to improve cotton farming globally. This makes it better for farmers and the environment. BCI provides farming-practice training. It promotes things like water efficiency and reducing the most harmful chemicals.,Main: 95% Polyester,"","The label may be small, but it's important. Machine wash according to instructions on care label.",32.0,0.0
12,2019-07-26 17:10:54.213338,2019-09-10 22:39:53.666169,1394927,ASOS DESIGN Curve chino jogger,Throw on and go,Model wears: UK 18/ EU 46/ US 14,Model's height: 174cm/5'8.5,"",Smooth woven fabric. Go-with-everything jersey. We partner with the Better Cotton Initiative to improve cotton farming globally. This makes it better for farmers and the environment. BCI provides farming-practice training. It promotes things like water efficiency and reducing the most harmful chemicals.,Lining: 100% Polyester,"","The label may be small, but it's important. Machine wash according to instructions on care label.",135.0,0.0
23,2019-07-26 17:10:54.291736,2019-09-10 22:39:53.750425,1494625,Pull&Bear elasticated waist mom jean in blue,"Buy them now, wear them forever",Model wears: UK 8/ EU 36/ US 4,Model's height: 168cm/5'6,"",Non-stretch denim. Thick.,Main: 100% Cotton.  ,"","Just here for the care instructions? Yeah, we thought so. Machine wash according to instructions on care label.",28.0,0.0
36,2019-07-26 17:10:54.338825,2019-09-10 22:39:53.834643,1400321,Peek & Beau Curve Exclusive Eco sleeve bikini top in floral,Just add water,Model wears: UK 18/ EU 46/ US 14,Model's height: 170cm/5'7,"",Stretchy swim fabric,Body: 100% Cotton.,"",Just here for the care instructions? We've got you covered. Machine wash according to instructions on care label.,60.0,0.0
7,2019-07-26 17:10:54.186818,2019-09-10 22:39:53.839173,1456736,adidas Originals adicolor cropped hoodie in white,A wardrobe staple,Model wears: UK 8/ EU 36/ US 4,Model's height:  175 cm/5'9,"",Soft-touch sweatshirt fabric. Style and comfort – it's a lifestyle.,Main: 95% Polyester,"",Avoid post-wash regrets. Always check the label.,35.0,0.0
37,2019-07-26 17:10:54.341868,2019-09-10 22:39:53.857279,1472298,Bershka striped jumpsuit in white,Daytime dressing made easy,Model wears: UK S/ EU S/ US XS,Model's height:  170cm/5'7,"",Stretch viscose,Main: 96% Viscose  4% Spandex. ,"",Just here for the care instructions? We've got you covered. Machine wash according to instructions on care label.,32.0,0.0
43,2019-07-26 17:10:54.360347,2019-09-10 22:39:53.882744,1495602,Pull&bear mixed print shorts in multi,Floral design,Model wears: UK S/ EU S/ US XS,Model's height:  170cm/5'7,"",Lightweight woven fabric. Drapes softly over the body.,Main: 95% Polyester,"","The label may be small, but it's important. Machine wash according to instructions on care label.",32.0,0.0
49,2019-07-26 17:10:54.378867,2019-09-10 22:39:53.909898,1416201,ASOS DESIGN crop tank in linen mix in black,Basic in the best way,Model wears: UK 8/ EU 36/ US 4,Model's height: 173cm/5'8,"",Lightweight,Main: 90% Polyester  10% Linen.,"","Check the label before you wash it. Fresh looks are for life, not just one wash.",42.0,0.0
17,2019-07-26 17:10:54.229608,2019-09-10 22:39:53.918827,1463827,ASOS DESIGN Tall top with broidery sleeve,For your daytime thing,Model wears: UK 8/ EU 36/ US 4,Model's height: 180cm/5'11,"",Soft jersey. Go-with-everything jersey. We partner with the Better Cotton Initiative to improve cotton farming globally. This makes it better for farmers and the environment. BCI provides farming-practice training. It promotes things like water efficiency and reducing the most harmful chemicals., Lace Trim: 100% Cotton  ,"","Just here for the care instructions? Yeah, we thought so. Machine wash according to instructions on care label.",67.0,0.0
55,2019-07-26 17:10:54.398257,2019-09-10 22:39:53.933281,1491267,Stradivarius asymmetric sleeveless top in white,Add-to-bag potential: considerable,Model wears: UK S/ EU S/ US XS,Model's height: 178cm/5'10,"",Go-with-everything jersey. It's a soft all-rounder.,Main: 95% Cotton.  5% Spandex.  ,"",Clothes have needs too y'know. Machine wash according to instructions on care label.,40.0,0.0
56,2019-07-26 17:10:54.401318,2019-09-10 22:39:53.937938,1447051,The North Face 92 Rage heavyweight long sleeve top in white,For your daytime thing,Model wears: UK S/ EU S/ US XS,Model's height: 173cm/5'8,"",Soft jersey. Go-with-everything jersey. We partner with the Better Cotton Initiative to improve cotton farming globally. This makes it better for farmers and the environment. BCI provides farming-practice training. It promotes things like water efficiency and reducing the most harmful chemicals.,Main: 95% Polyester,"","Just here for the care instructions? Yeah, we thought so. Machine wash according to instructions on care label.",28.0,0.0
69,2019-07-26 17:10:54.443051,2019-09-10 22:39:53.9869,1436503,ASOS DESIGN maternity mix & match pyjama jersey pants,You're invited to this PJ party,Model wears: UK 8/ EU 36/ US 4,Model's height:  174 cm/5'8.5,"",Soft jersey. We partner with the Better Cotton Initiative to improve cotton farming globally. This makes it better for farmers and the environment. BCI provides farming-practice training. It promotes things like water efficiency and reducing the most harmful chemicals.,Main: 95% Polyester,"","Just here for the care instructions? Yeah, we thought so. Machine wash according to instructions on care label.",35.0,0.0
79,2019-07-26 17:10:54.474987,2019-09-10 22:39:54.030596,1491267,Stradivarius asymmetric sleeveless top in white,Add-to-bag potential: considerable,Model wears: UK S/ EU S/ US XS,Model's height: 178cm/5'10,"",Go-with-everything jersey. It's a soft all-rounder.,Main: 95% Polyester  5% Spandex. ,"",Clothes have needs too y'know. Machine wash according to instructions on care label.,40.0,0.0
104,2019-07-26 17:10:54.564043,2019-09-10 22:39:54.21173,1472298,Bershka striped jumpsuit in white,Daytime dressing made easy,Model wears: UK S/ EU S/ US XS,Model's height:  170cm/5'7,"",Stretch viscose,Main: 96% Viscose  4% Spandex. ,"",Just here for the care instructions? We've got you covered. Machine wash according to instructions on care label.,32.0,0.0
109,2019-07-26 17:10:54.581093,2019-09-10 22:39:54.233105,1476242,Pull&Bear comfort stretch mom jean in black,Just like your mum's in the 80s,Model wears: UK 8/ EU 36/ US 4,Model's height:  173 cm/5'8,"",Stretch denim,Main: 98% Cotton 2% Spandex. ,"","The label may be small, but it's important. Hand wash only.",45.0,0.0
70,2019-07-26 17:10:54.446141,2019-09-10 22:39:54.259367,1394927,ASOS DESIGN Curve chino jogger,Throw on and go,Model wears: UK 18/ EU 46/ US 14,Model's height: 174cm/5'8.5,"",Smooth woven fabric. We partner with the Better Cotton Initiative to improve cotton farming globally. This makes it better for farmers and the environment. BCI provides farming-practice training. It promotes things like water efficiency and reducing the most harmful chemicals.,Main: 95% Polyester,"","You know the drill. Always check the label. Separate your colors, etc.",135.0,0.0
156,2019-07-26 17:10:54.737375,2019-09-10 22:39:54.32327,1447054,The North Face Red Box hoodie in gray/pink,Throw on and go,Model wears: UK S/ EU S/ US XS,Model's height: 173cm/5'8,"",Soft sweatshirt fabric. We partner with the Better Cotton Initiative to improve cotton farming globally. This makes it better for farmers and the environment. BCI provides farming-practice training. It promotes things like water efficiency and reducing the most harmful chemicals.,Main: 50% Cotton  50% Polyester.,"","Just here for the care instructions? Yeah, we thought so. Machine wash according to instructions on care label.",29.9,0.0
134,2019-07-26 17:10:54.664871,2019-09-10 22:39:54.34326,1485835,Stradivarius tailored pants in yellow,Part of a two-piece set,Model wears: UK S/ EU S/ US XS,Model's height: 178cm/5'10,"",Lightweight,Main: 55% Viscose  24% Cotton  21% Linen.,"",Just here for the care instructions? We've got you covered. Machine wash according to instructions on care label.,35.0,0.0
135,2019-07-26 17:10:54.668302,2019-09-10 22:39:54.348154,1447066,The North Face Shine On t-shirt in pink with pocket,For your daytime thing,Model wears: UK S/ EU S/ US XS,Model's height: 173cm/5'8,"",Go-with-everything jersey. We partner with the Better Cotton Initiative to improve cotton farming globally. This makes it better for farmers and the environment. BCI provides farming-practice training. It promotes things like water efficiency and reducing the most harmful chemicals.,Main: 95% Polyester,"","Just here for the care instructions? Yeah, we thought so. Machine wash according to instructions on care label.",32.0,0.0
234,2019-07-26 17:10:55.02254,2019-09-10 22:39:54.435293,1447054,The North Face Red Box hoodie in gray/pink,Throw on and go,Model wears: UK S/ EU S/ US XS,Model's height: 173cm/5'8,"",Soft sweatshirt fabric. We partner with the Better Cotton Initiative to improve cotton farming globally. This makes it better for farmers and the environment. BCI provides farming-practice training. It promotes things like water efficiency and reducing the most harmful chemicals.,Main: 50% Cotton 50% Polyester.  ,"","The label may be small, but it's important. Machine wash according to instructions on care label.",29.9,0.0
198,2019-07-26 17:10:54.891643,2019-09-10 22:39:54.609559,1419960,Wild Honey cami dress with bunny ties in ditsy print,Break out the blooms,Model wears: UK S/ EU S/ US XS,Model's height: 170cm/5'7,"",Lightweight woven fabric,Body: 100% Polyester.  ,"",Just here for the care instructions? We've got you covered. Machine wash according to instructions on care label.,30.0,0.0
50,2019-07-26 17:10:54.382027,2019-09-10 22:39:55.015139,1415544,Simply Be longline denim shorts with distressing in stonewash,Best paired with warm weather,Model wears: UK 18/ EU 46/ US 14,Model's height: 178cm/5'10,"",Stretch denim. For a tight cut without the restriction.,Main:  21% Polyester  12% Viscose  1% Spandex.,"",Just here for the care instructions? We've got you covered. Hand wash only.,23.0,0.0
